old_url,new_url,page_type,language,title,meta_description,h1,canonical,hreflang,indexability,redirect_type,primary_cta,files_assets_to_migrate,legal_blocks_required,responsible_person,migration_status
https://greencard.agency/,/ru,home,ru,GreenCard Agency — международное автострахование,Оформление Green Card и приграничного страхования с поддержкой на нескольких языках.,Международное автострахование GreenCard,/ru,"ru=/ru|pl=/pl|en=/en|be=/be|x-default=/ru",index,301,Оставить заявку,"hero-image,partner-logos",legal-entity|consent-snippet,Product Owner,ready_for_content
https://greencard.agency/ru/about_us_ru/,/ru/about-us,about,ru,О компании GreenCard Agency,Кто мы, как работаем и почему нам доверяют оформление полисов для поездок за границу.,О компании,/ru/about-us,"ru=/ru/about-us|pl=/pl/about-us|en=/en/about-us|be=/be/about-us",index,301,Связаться с нами,"team-photos,certificates",legal-entity,Content Lead,ready_for_content
https://greencard.agency/ru/towarzystwa_ubezpieczeniowe_ru/,/ru/insurers,listing,ru,Страховые компании-партнеры,Список страховых партнеров и условия покрытия по направлениям поездок.,Страховые компании-партнеры,/ru/insurers,"ru=/ru/insurers|pl=/pl/insurers|en=/en/insurers|be=/be/insurers",index,301,Оставить заявку,"insurer-logos",partner-disclosure,Insurance Manager,ready_for_content
https://greencard.agency/ru/regulamin_ru/,/ru/regulations,legal,ru,Регламент и условия обслуживания,Правила оформления полисов, обработки заявок и основные юридические условия сервиса.,Регламент,/ru/regulations,"ru=/ru/regulations|pl=/pl/regulations|en=/en/regulations|be=/be/regulations",index,301,Ознакомиться с условиями,"pdf-attachments",regulations|privacy|complaints,Legal,ready_for_legal_review
https://greencard.agency/ru/dokumenty_do_pobrania_ru/,/ru/documents,documents,ru,Документы для скачивания,Актуальные бланки, заявления и дополнительные документы для оформления страхования.,Документы для скачивания,/ru/documents,"ru=/ru/documents|pl=/pl/documents|en=/en/documents|be=/be/documents",index,301,Скачать документ,"pdf-docs,forms",document-versioning,Operations,ready_for_content
